{
  "version": "1.0.0",
  "phase": "Phase 6",
  "datasetId": "context-rules",
  "lifecycleStatus": "CanonicalDraft",
  "reviewStatus": "Canonical",
  "capturedAt": "2026-07-14T00:00:00.000Z",
  "approvedAt": "2026-07-14T00:00:00.000Z",
  "approvalRecord": "data/knowledge/approvals/context-rules.phase6.approval.2026-07-14.json",
  "records": [
    {
      "id": "CTX-001",
      "domain": "context-rule",
      "contextType": "number-chain",
      "title": "完整鏈式與最後主數雙層保存",
      "matchKey": { "type": "number-chain", "key": "compound-and-final" },
      "reviewStatus": "Canonical",
      "version": "1.0.0",
      "lastReviewedAt": "2026-07-14T00:00:00.000Z",
      "dependsOn": ["phase4:continuous-reduction", "number-topic:0-9"],
      "rule": {
        "summary": "所有可縮減數值同時保存完整鏈式與最後主數；兩者用途不同，不互相覆蓋。",
        "inputs": ["rawTotal", "reductionChain"],
        "outputs": ["fullChain", "finalNumber"],
        "constraints": ["fullChain 必須保留每一步縮減", "finalNumber 必須等於鏈式最後一段", "顯示層不得只保存 finalNumber"],
        "interpretationBoundary": "完整鏈式用於呈現形成過程；最後主數只引用已核准的 0～9 基本本體。"
      },
      "sourceRefs": [
        { "sourceId": "CANDIDATE-P6-0.1.0", "sourceType": "github-candidate", "location": "data/knowledge/candidates/context-rules.phase6.v0.1.json", "section": "CTX-001" },
        { "sourceId": "APPROVAL-P6-2026-07-14", "sourceType": "approval-record", "location": "data/knowledge/approvals/context-rules.phase6.approval.2026-07-14.json", "section": "CTX-001" },
        { "sourceId": "ENGINE-2.2.1", "sourceType": "github", "location": "public/core.js", "section": "chainFromNumber" }
      ],
      "governance": { "approvedBy": "ours9638-create", "approvalRecord": "data/knowledge/approvals/context-rules.phase6.approval.2026-07-14.json", "decision": "Adopt", "notes": "Canonical v1.0.0 draft. Runtime publication and merge remain separately gated." }
    },
    {
      "id": "CTX-002",
      "domain": "context-rule",
      "contextType": "number-chain",
      "title": "複合數與基本數字分層引用",
      "matchKey": { "type": "number-chain", "key": "compound-context-reference" },
      "reviewStatus": "Canonical",
      "version": "1.0.0",
      "lastReviewedAt": "2026-07-14T00:00:00.000Z",
      "dependsOn": ["context-rule:CTX-001", "number-topic:0-9"],
      "rule": {
        "summary": "複合數保留來源與形成脈絡；未經獨立來源核對與人工核准的複合數意義維持 Pending，不建立第二套基本數字定義。",
        "inputs": ["fullChain", "finalNumber", "contextRole"],
        "outputs": ["compoundContextRef", "baseNumberRef", "compoundReviewStatus"],
        "constraints": ["複合數層不得複製基本數字全文", "未核准的複合數意義必須為空白或 Pending", "未來正式複合數資料庫必須具有獨立版本、來源與審核流程"],
        "interpretationBoundary": "複合數只描述形成脈絡；基本性質由 finalNumber 對應的正式 NUM 條目提供。"
      },
      "sourceRefs": [
        { "sourceId": "CANDIDATE-P6-0.1.0", "sourceType": "github-candidate", "location": "data/knowledge/candidates/context-rules.phase6.v0.1.json", "section": "CTX-002" },
        { "sourceId": "APPROVAL-P6-2026-07-14", "sourceType": "approval-record", "location": "data/knowledge/approvals/context-rules.phase6.approval.2026-07-14.json", "section": "CTX-002" }
      ],
      "governance": { "approvedBy": "ours9638-create", "approvalRecord": "data/knowledge/approvals/context-rules.phase6.approval.2026-07-14.json", "decision": "AdoptWithChanges", "notes": "未核准複合數維持 Pending；未來資料庫需獨立版本、來源與審核。" }
    },
    {
      "id": "CTX-003",
      "domain": "context-rule",
      "contextType": "calendar-role",
      "title": "國曆與農曆結果分開保存",
      "matchKey": { "type": "calendar-role", "key": "solar-lunar-separation" },
      "reviewStatus": "Canonical",
      "version": "1.0.0",
      "lastReviewedAt": "2026-07-14T00:00:00.000Z",
      "dependsOn": ["phase4:solar-calculation", "phase4:lunar-calculation"],
      "rule": {
        "summary": "國曆與農曆是兩組可並列的計算結果，資料層保留各自來源、鏈式、角色與生日切換狀態。",
        "inputs": ["solarResult", "lunarResult"],
        "outputs": ["solarContext", "lunarContext"],
        "constraints": ["不得把國曆與農曆數值相加成未定義的新數字", "不得用其中一套覆蓋另一套", "農曆必須保留閏月與計算月資訊"],
        "interpretationBoundary": "解讀可以比較兩組結果，但不得把比較文字反寫為計算規則。"
      },
      "sourceRefs": [
        { "sourceId": "CANDIDATE-P6-0.1.0", "sourceType": "github-candidate", "location": "data/knowledge/candidates/context-rules.phase6.v0.1.json", "section": "CTX-003" },
        { "sourceId": "APPROVAL-P6-2026-07-14", "sourceType": "approval-record", "location": "data/knowledge/approvals/context-rules.phase6.approval.2026-07-14.json", "section": "CTX-003" }
      ],
      "governance": { "approvedBy": "ours9638-create", "approvalRecord": "data/knowledge/approvals/context-rules.phase6.approval.2026-07-14.json", "decision": "Adopt", "notes": "Canonical v1.0.0 draft. Runtime publication and merge remain separately gated." }
    },
    {
      "id": "CTX-004",
      "domain": "context-rule",
      "contextType": "position-role",
      "title": "日座數與日月綻放分離",
      "matchKey": { "type": "position-role", "key": "day-seat-and-day-moon" },
      "reviewStatus": "Canonical",
      "version": "1.0.0",
      "lastReviewedAt": "2026-07-14T00:00:00.000Z",
      "dependsOn": ["phase4:day-seat", "phase4:day-moon-chain", "number-topic:0-9"],
      "rule": {
        "summary": "日座數與日月綻放是不同位置角色；日月綻放保存月與日形成的完整鏈式及最後主數，國曆與農曆各自保存。",
        "inputs": ["calendarType", "sourceMonth", "sourceDay", "daySeatFinal", "dayMoonFullChain", "dayMoonFinal"],
        "outputs": ["daySeatFinal", "dayMoonFullChain", "dayMoonFinal", "calendarType", "sourceMonth", "sourceDay", "baseNumberRef"],
        "constraints": ["日座數不得與日月綻放合併", "國曆與農曆分開保存", "日月綻放完整鏈不得只保留最後主數", "位置解讀不得改寫數字本體"],
        "interpretationBoundary": "日月綻放描述頻率如何向外展開；日座數描述出生日位置；人格與生命核心仍由其他已定義位置共同判讀。"
      },
      "sourceRefs": [
        { "sourceId": "CANDIDATE-P6-0.1.0", "sourceType": "github-candidate", "location": "data/knowledge/candidates/context-rules.phase6.v0.1.json", "section": "CTX-004" },
        { "sourceId": "APPROVAL-P6-2026-07-14", "sourceType": "approval-record", "location": "data/knowledge/approvals/context-rules.phase6.approval.2026-07-14.json", "section": "CTX-004" },
        { "sourceId": "ENGINE-2.2.1", "sourceType": "github", "location": "public/core.js", "section": "calculateHorseSet/dayMoonChain" }
      ],
      "governance": { "approvedBy": "ours9638-create", "approvalRecord": "data/knowledge/approvals/context-rules.phase6.approval.2026-07-14.json", "decision": "AdoptWithChanges", "notes": "固定輸出 daySeatFinal、dayMoonFullChain、dayMoonFinal、calendarType、sourceMonth、sourceDay、baseNumberRef。" }
    },
    {
      "id": "CTX-005",
      "domain": "context-rule",
      "contextType": "position-role",
      "title": "四組木馬依期間分工",
      "matchKey": { "type": "position-role", "key": "horse-1-4" },
      "reviewStatus": "Canonical",
      "version": "1.0.0",
      "lastReviewedAt": "2026-07-14T00:00:00.000Z",
      "dependsOn": ["phase4:horse-formula", "number-topic:0-9"],
      "rule": {
        "summary": "木馬一至四使用固定公式與固定期間角色；數值為 0 時仍保留，不自行改成 9。",
        "inputs": ["horseFirst", "horseSecond", "horseThird", "horseFourth"],
        "outputs": ["before40", "transition36to40", "lifelong", "after41"],
        "constraints": ["木馬一代表 40 歲前", "木馬二代表 36～40 歲", "木馬三代表終其一生", "木馬四代表 41 歲後", "結果 0 必須保留", "位置角色不得與數字本體混寫"],
        "interpretationBoundary": "木馬描述潛意識自動模式在不同期間的運作位置；數字意義仍引用正式基本本體。"
      },
      "sourceRefs": [
        { "sourceId": "CANDIDATE-P6-0.1.0", "sourceType": "github-candidate", "location": "data/knowledge/candidates/context-rules.phase6.v0.1.json", "section": "CTX-005" },
        { "sourceId": "APPROVAL-P6-2026-07-14", "sourceType": "approval-record", "location": "data/knowledge/approvals/context-rules.phase6.approval.2026-07-14.json", "section": "CTX-005" }
      ],
      "governance": { "approvedBy": "ours9638-create", "approvalRecord": "data/knowledge/approvals/context-rules.phase6.approval.2026-07-14.json", "decision": "Adopt", "notes": "Canonical v1.0.0 draft. Runtime publication and merge remain separately gated." }
    },
    {
      "id": "CTX-006",
      "domain": "context-rule",
      "contextType": "position-role",
      "title": "國曆與農曆貴人分開保存",
      "matchKey": { "type": "position-role", "key": "solar-lunar-noble" },
      "reviewStatus": "Canonical",
      "version": "1.0.0",
      "lastReviewedAt": "2026-07-14T00:00:00.000Z",
      "dependsOn": ["phase4:noble-formula", "number-topic:0-9"],
      "rule": {
        "summary": "國曆貴人與農曆貴人使用不同日期來源，必須保存為兩個獨立欄位。",
        "inputs": ["solarNoble", "lunarNoble"],
        "outputs": ["solarNobleContext", "lunarNobleContext"],
        "constraints": ["不得合併成單一貴人數", "不得以相同結果推定兩者角色相同", "只引用基本數字條目"],
        "interpretationBoundary": "貴人位置描述支持、協作與外部連結的線索，不作保證性預測。"
      },
      "sourceRefs": [
        { "sourceId": "CANDIDATE-P6-0.1.0", "sourceType": "github-candidate", "location": "data/knowledge/candidates/context-rules.phase6.v0.1.json", "section": "CTX-006" },
        { "sourceId": "APPROVAL-P6-2026-07-14", "sourceType": "approval-record", "location": "data/knowledge/approvals/context-rules.phase6.approval.2026-07-14.json", "section": "CTX-006" }
      ],
      "governance": { "approvedBy": "ours9638-create", "approvalRecord": "data/knowledge/approvals/context-rules.phase6.approval.2026-07-14.json", "decision": "Adopt", "notes": "Canonical v1.0.0 draft. Runtime publication and merge remain separately gated." }
    },
    {
      "id": "CTX-007",
      "domain": "context-rule",
      "contextType": "annual-cycle",
      "title": "流年描述年度行動主題",
      "matchKey": { "type": "annual-cycle", "key": "annual-flow" },
      "reviewStatus": "Canonical",
      "version": "1.0.0",
      "lastReviewedAt": "2026-07-14T00:00:00.000Z",
      "dependsOn": ["phase4:annual-flow", "number-topic:0-9"],
      "rule": {
        "summary": "流年保留完整鏈式與最後主數，用於描述當年度較明顯的行動主題與發展方向。",
        "inputs": ["calendarType", "adoptedYear", "annualChain", "annualFinal"],
        "outputs": ["annualThemeRef"],
        "constraints": ["國曆與農曆分開保存", "流年不得當成人格定義", "生日切換前後使用對應 adoptedYear"],